<?xml version="1.0" encoding="UTF-8"?>
<xs:schema xmlns="http://www.uniovi.es" elementFormDefault="qualified" targetNamespace="http://www.uniovi.es" xmlns:xs="http://www.w3.org/2001/XMLSchema">
	<xs:element name="circuito">
		<xs:complexType>
			<xs:sequence>
				<xs:element ref="nombre" />
				<xs:element ref="longitud" />
				<xs:element ref="anchura" />
				<xs:element ref="fecha" />
				<xs:element ref="hora" />
				<xs:element ref="vueltas" />
				<xs:element ref="localidad" />
				<xs:element ref="pais" />
				<xs:element ref="patrocinador" />
				<xs:element ref="referencias" />
				<xs:element ref="fotografias" />
				<xs:element ref="videos" />
				<xs:element ref="origen" />
				<xs:element ref="puntos" />
				<xs:element ref="vencedor" />
				<xs:element ref="clasificacion" />
			</xs:sequence>
		</xs:complexType>
	</xs:element>

	<xs:element name="nombre" type="xs:string" />

	<xs:element name="longitud">
		<xs:complexType>
			<xs:simpleContent>
				<xs:extension base="xs:decimal">
					<xs:attribute name="unidad" type="xs:string" use="required" />
				</xs:extension>
			</xs:simpleContent>
		</xs:complexType>
	</xs:element>

	<xs:element name="anchura">
		<xs:complexType>
			<xs:simpleContent>
				<xs:extension base="xs:decimal">
					<xs:attribute name="unidad" type="xs:string" use="required" />
				</xs:extension>
			</xs:simpleContent>
		</xs:complexType>
	</xs:element>

	<xs:element name="fecha" type="xs:date" />

	<xs:element name="hora" type="xs:time" />

	<xs:element name="vueltas" type="xs:positiveInteger" />

	<xs:element name="localidad" type="xs:string" />

	<xs:element name="pais" type="xs:string" />

	<xs:element name="patrocinador" type="xs:string" />

	<xs:element name="referencias">
		<xs:complexType>
			<xs:sequence>
				<xs:element name="referencia" type="xs:string" minOccurs="3" maxOccurs="unbounded" />
			</xs:sequence>
		</xs:complexType>
	</xs:element>

	<xs:element name="fotografias">
        <xs:complexType>
            <xs:sequence>
                <xs:element ref="fotografia" minOccurs="1" maxOccurs="5" />
            </xs:sequence>
        </xs:complexType>
    </xs:element>

	<xs:element name="fotografia">
		<xs:complexType>
			<xs:sequence>
				<xs:element ref="ruta" />
				<xs:element ref="descripcion" />
			</xs:sequence>
		</xs:complexType>
	</xs:element>

	<xs:element name="ruta" type="xs:string" />

	<xs:element name="descripcion" type="xs:string" />

	<xs:element name="videos">
		<xs:complexType>
			<xs:sequence>
				<xs:element ref="video" minOccurs="1" maxOccurs="3" />
			</xs:sequence>
		</xs:complexType>
	</xs:element>

	<xs:element name="video">
		<xs:complexType>
			<xs:sequence>
				<xs:element ref="ruta" />
				<xs:element ref="descripcion" />
			</xs:sequence>
		</xs:complexType>
	</xs:element>

	<xs:element name="origen">
		<xs:complexType>
			<xs:sequence>
				<xs:element ref="longitudGeo" />
				<xs:element ref="latitudGeo" />
				<xs:element ref="altitudGeo" />
			</xs:sequence>
		</xs:complexType>
	</xs:element>
	
	<xs:element name="longitudGeo" type="xs:decimal" />

	<xs:element name="latitudGeo" type="xs:decimal" />

	<xs:element name="altitudGeo" type="xs:decimal" />

	<xs:element name="puntos">
		<xs:complexType>
			<xs:sequence>
				<xs:element minOccurs="1" maxOccurs="unbounded" ref="punto" />
			</xs:sequence>
		</xs:complexType>
	</xs:element>

	<xs:element name="punto">
		<xs:complexType>
			<xs:sequence>
				<xs:element ref="distancia" />
				<xs:element ref="puntoFinal" />
				<xs:element ref="sector" />
			</xs:sequence>
		</xs:complexType>
	</xs:element>

	<xs:element name="distancia">
		<xs:complexType>
			<xs:simpleContent>
				<xs:extension base="xs:decimal">
					<xs:attribute name="unidad" type="xs:string" use="required" />
				</xs:extension>
			</xs:simpleContent>
		</xs:complexType>
	</xs:element>

	<xs:element name="puntoFinal">
		<xs:complexType>
			<xs:sequence>
				<xs:element ref="longitudGeo" />
				<xs:element ref="latitudGeo" />
				<xs:element ref="altitudGeo" />
			</xs:sequence>
		</xs:complexType>
	</xs:element>

	<xs:element name="sector" type="xs:positiveInteger" />

	<xs:element name="vencedor">
		<xs:complexType>
			<xs:sequence>
				<xs:element ref="nombre" />
				<xs:element ref="tiempo" />
			</xs:sequence>
		</xs:complexType>
	</xs:element>

	<xs:element name="tiempo" type="xs:duration" />

	<xs:element name="clasificacion">
		<xs:complexType>
			<xs:sequence>
				<xs:element minOccurs="3" maxOccurs="3" ref="posicion" />
			</xs:sequence>
		</xs:complexType>
	</xs:element>

	<xs:element name="posicion">
		<xs:complexType>
			<xs:sequence>
				<xs:element ref="puesto" />
				<xs:element ref="nombre" />
				<xs:element ref="puntosMundial" />
			</xs:sequence>
		</xs:complexType>
	</xs:element>

	<xs:element name="puesto" type="xs:positiveInteger" />

	<xs:element name="puntosMundial" type="xs:integer" />

</xs:schema>